{
  "schema_version": 1,
  "work_id": "saki-the-open-window",
  "edition_id": "saki-open-window-vi-ai-2026",
  "source_edition_id": "saki-open-window-en-john-lane-1914",
  "links": [
    {
      "source": [
        "saki-the-open-window:1.1"
      ],
      "target": [
        "saki-the-open-window:1.1"
      ]
    },
    {
      "source": [
        "saki-the-open-window:1.2"
      ],
      "target": [
        "saki-the-open-window:1.2"
      ]
    },
    {
      "source": [
        "saki-the-open-window:1.3"
      ],
      "target": [
        "saki-the-open-window:1.3"
      ]
    },
    {
      "source": [
        "saki-the-open-window:1.4"
      ],
      "target": [
        "saki-the-open-window:1.4"
      ]
    },
    {
      "source": [
        "saki-the-open-window:1.5"
      ],
      "target": [
        "saki-the-open-window:1.5"
      ]
    },
    {
      "source": [
        "saki-the-open-window:1.6"
      ],
      "target": [
        "saki-the-open-window:1.6"
      ]
    },
    {
      "source": [
        "saki-the-open-window:1.7"
      ],
      "target": [
        "saki-the-open-window:1.7"
      ]
    },
    {
      "source": [
        "saki-the-open-window:1.8"
      ],
      "target": [
        "saki-the-open-window:1.8"
      ]
    },
    {
      "source": [
        "saki-the-open-window:1.9"
      ],
      "target": [
        "saki-the-open-window:1.9"
      ]
    },
    {
      "source": [
        "saki-the-open-window:1.10"
      ],
      "target": [
        "saki-the-open-window:1.10"
      ]
    },
    {
      "source": [
        "saki-the-open-window:1.11"
      ],
      "target": [
        "saki-the-open-window:1.11"
      ]
    },
    {
      "source": [
        "saki-the-open-window:1.12"
      ],
      "target": [
        "saki-the-open-window:1.12"
      ]
    },
    {
      "source": [
        "saki-the-open-window:1.13"
      ],
      "target": [
        "saki-the-open-window:1.13"
      ]
    },
    {
      "source": [
        "saki-the-open-window:1.14"
      ],
      "target": [
        "saki-the-open-window:1.14"
      ]
    },
    {
      "source": [
        "saki-the-open-window:1.15"
      ],
      "target": [
        "saki-the-open-window:1.15"
      ]
    },
    {
      "source": [
        "saki-the-open-window:1.16"
      ],
      "target": [
        "saki-the-open-window:1.16"
      ]
    },
    {
      "source": [
        "saki-the-open-window:1.17"
      ],
      "target": [
        "saki-the-open-window:1.17"
      ]
    },
    {
      "source": [
        "saki-the-open-window:1.18"
      ],
      "target": [
        "saki-the-open-window:1.18"
      ]
    },
    {
      "source": [
        "saki-the-open-window:1.19"
      ],
      "target": [
        "saki-the-open-window:1.19"
      ]
    },
    {
      "source": [
        "saki-the-open-window:1.20"
      ],
      "target": [
        "saki-the-open-window:1.20"
      ]
    },
    {
      "source": [
        "saki-the-open-window:1.21"
      ],
      "target": [
        "saki-the-open-window:1.21"
      ]
    },
    {
      "source": [
        "saki-the-open-window:1.22"
      ],
      "target": [
        "saki-the-open-window:1.22"
      ]
    },
    {
      "source": [
        "saki-the-open-window:1.23"
      ],
      "target": [
        "saki-the-open-window:1.23"
      ]
    },
    {
      "source": [
        "saki-the-open-window:1.24"
      ],
      "target": [
        "saki-the-open-window:1.24"
      ]
    },
    {
      "source": [
        "saki-the-open-window:1.25"
      ],
      "target": [
        "saki-the-open-window:1.25"
      ]
    },
    {
      "source": [
        "saki-the-open-window:1.26"
      ],
      "target": [
        "saki-the-open-window:1.26"
      ]
    },
    {
      "source": [
        "saki-the-open-window:1.27"
      ],
      "target": [
        "saki-the-open-window:1.27"
      ]
    },
    {
      "source": [
        "saki-the-open-window:1.28"
      ],
      "target": [
        "saki-the-open-window:1.28"
      ]
    },
    {
      "source": [
        "saki-the-open-window:1.29"
      ],
      "target": [
        "saki-the-open-window:1.29"
      ]
    }
  ]
}
