{
  "schema_version": 1,
  "work_id": "machado-um-apologo",
  "edition_id": "machado-apologo-vi-ai-draft-2026",
  "source_edition_id": "machado-apologo-pt-laemmert-1896",
  "links": [
    {
      "source": [
        "machado-um-apologo:1.1"
      ],
      "target": [
        "machado-um-apologo:1.1"
      ]
    },
    {
      "source": [
        "machado-um-apologo:1.2"
      ],
      "target": [
        "machado-um-apologo:1.2"
      ]
    },
    {
      "source": [
        "machado-um-apologo:1.3"
      ],
      "target": [
        "machado-um-apologo:1.3"
      ]
    },
    {
      "source": [
        "machado-um-apologo:1.4"
      ],
      "target": [
        "machado-um-apologo:1.4"
      ]
    },
    {
      "source": [
        "machado-um-apologo:1.5"
      ],
      "target": [
        "machado-um-apologo:1.5"
      ]
    },
    {
      "source": [
        "machado-um-apologo:1.6"
      ],
      "target": [
        "machado-um-apologo:1.6"
      ]
    },
    {
      "source": [
        "machado-um-apologo:1.7"
      ],
      "target": [
        "machado-um-apologo:1.7"
      ]
    },
    {
      "source": [
        "machado-um-apologo:1.8"
      ],
      "target": [
        "machado-um-apologo:1.8"
      ]
    },
    {
      "source": [
        "machado-um-apologo:1.9"
      ],
      "target": [
        "machado-um-apologo:1.9"
      ]
    },
    {
      "source": [
        "machado-um-apologo:1.10"
      ],
      "target": [
        "machado-um-apologo:1.10"
      ]
    },
    {
      "source": [
        "machado-um-apologo:1.11"
      ],
      "target": [
        "machado-um-apologo:1.11"
      ]
    },
    {
      "source": [
        "machado-um-apologo:1.12"
      ],
      "target": [
        "machado-um-apologo:1.12"
      ]
    },
    {
      "source": [
        "machado-um-apologo:1.13"
      ],
      "target": [
        "machado-um-apologo:1.13"
      ]
    },
    {
      "source": [
        "machado-um-apologo:1.14"
      ],
      "target": [
        "machado-um-apologo:1.14"
      ]
    },
    {
      "source": [
        "machado-um-apologo:1.15"
      ],
      "target": [
        "machado-um-apologo:1.15"
      ]
    },
    {
      "source": [
        "machado-um-apologo:1.16"
      ],
      "target": [
        "machado-um-apologo:1.16"
      ]
    },
    {
      "source": [
        "machado-um-apologo:1.17"
      ],
      "target": [
        "machado-um-apologo:1.17"
      ]
    },
    {
      "source": [
        "machado-um-apologo:1.18"
      ],
      "target": [
        "machado-um-apologo:1.18"
      ]
    },
    {
      "source": [
        "machado-um-apologo:1.19"
      ],
      "target": [
        "machado-um-apologo:1.19"
      ]
    },
    {
      "source": [
        "machado-um-apologo:1.20"
      ],
      "target": [
        "machado-um-apologo:1.20"
      ]
    },
    {
      "source": [
        "machado-um-apologo:1.21"
      ],
      "target": [
        "machado-um-apologo:1.21"
      ]
    },
    {
      "source": [
        "machado-um-apologo:1.22"
      ],
      "target": [
        "machado-um-apologo:1.22"
      ]
    }
  ]
}
