{
  "schema_version": 1,
  "work_id": "chopin-story-of-an-hour",
  "edition_id": "chopin-hour-vi-ai-2026",
  "source_edition_id": "chopin-hour-en-1895",
  "links": [
    {
      "source": [
        "chopin-story-of-an-hour:1.1"
      ],
      "target": [
        "chopin-story-of-an-hour:1.1"
      ]
    },
    {
      "source": [
        "chopin-story-of-an-hour:1.2"
      ],
      "target": [
        "chopin-story-of-an-hour:1.2"
      ]
    },
    {
      "source": [
        "chopin-story-of-an-hour:1.3"
      ],
      "target": [
        "chopin-story-of-an-hour:1.3"
      ]
    },
    {
      "source": [
        "chopin-story-of-an-hour:1.4"
      ],
      "target": [
        "chopin-story-of-an-hour:1.4"
      ]
    },
    {
      "source": [
        "chopin-story-of-an-hour:1.5"
      ],
      "target": [
        "chopin-story-of-an-hour:1.5"
      ]
    },
    {
      "source": [
        "chopin-story-of-an-hour:1.6"
      ],
      "target": [
        "chopin-story-of-an-hour:1.6"
      ]
    },
    {
      "source": [
        "chopin-story-of-an-hour:1.7"
      ],
      "target": [
        "chopin-story-of-an-hour:1.7"
      ]
    },
    {
      "source": [
        "chopin-story-of-an-hour:1.8"
      ],
      "target": [
        "chopin-story-of-an-hour:1.8"
      ]
    },
    {
      "source": [
        "chopin-story-of-an-hour:1.9"
      ],
      "target": [
        "chopin-story-of-an-hour:1.9"
      ]
    },
    {
      "source": [
        "chopin-story-of-an-hour:1.10"
      ],
      "target": [
        "chopin-story-of-an-hour:1.10"
      ]
    },
    {
      "source": [
        "chopin-story-of-an-hour:1.11"
      ],
      "target": [
        "chopin-story-of-an-hour:1.11"
      ]
    },
    {
      "source": [
        "chopin-story-of-an-hour:1.12"
      ],
      "target": [
        "chopin-story-of-an-hour:1.12"
      ]
    },
    {
      "source": [
        "chopin-story-of-an-hour:1.13"
      ],
      "target": [
        "chopin-story-of-an-hour:1.13"
      ]
    },
    {
      "source": [
        "chopin-story-of-an-hour:1.14"
      ],
      "target": [
        "chopin-story-of-an-hour:1.14"
      ]
    },
    {
      "source": [
        "chopin-story-of-an-hour:1.15"
      ],
      "target": [
        "chopin-story-of-an-hour:1.15"
      ]
    },
    {
      "source": [
        "chopin-story-of-an-hour:1.16"
      ],
      "target": [
        "chopin-story-of-an-hour:1.16"
      ]
    },
    {
      "source": [
        "chopin-story-of-an-hour:1.17"
      ],
      "target": [
        "chopin-story-of-an-hour:1.17"
      ]
    },
    {
      "source": [
        "chopin-story-of-an-hour:1.18"
      ],
      "target": [
        "chopin-story-of-an-hour:1.18"
      ]
    },
    {
      "source": [
        "chopin-story-of-an-hour:1.19"
      ],
      "target": [
        "chopin-story-of-an-hour:1.19"
      ]
    },
    {
      "source": [
        "chopin-story-of-an-hour:1.20"
      ],
      "target": [
        "chopin-story-of-an-hour:1.20"
      ]
    },
    {
      "source": [
        "chopin-story-of-an-hour:1.21"
      ],
      "target": [
        "chopin-story-of-an-hour:1.21"
      ]
    },
    {
      "source": [
        "chopin-story-of-an-hour:1.22"
      ],
      "target": [
        "chopin-story-of-an-hour:1.22"
      ]
    },
    {
      "source": [
        "chopin-story-of-an-hour:1.23"
      ],
      "target": [
        "chopin-story-of-an-hour:1.23"
      ]
    }
  ]
}
